{
  "id": "inc-test-001",
  "alert_ids": ["alert-test-001"],
  "status": "INCIDENT_STATUS_INVESTIGATING",
  "severity": "SEVERITY_HIGH",
  "created_at": "2026-09-12T09:03:00Z",
  "updated_at": "2026-09-12T09:05:00Z",
  "title": "Synthetic WAF incident",
  "summary": "synthetic contract test data — not a real security finding"
}
